,actual,cleared,data_year,offense,ori,state_abbr,agency_name,county_name
4641,1,1,2017,arson,NJ0133700,NJ,"Ocean Township, Monmouth County Police Department",MONMOUTH
4642,0,0,2017,arson,NJ0133800,NJ,Oceanport Police Department,MONMOUTH
4643,1,0,2017,arson,NJ0133900,NJ,Hazlet Township Police Department,MONMOUTH
4644,0,0,2017,arson,NJ0134000,NJ,Red Bank Police Department,MONMOUTH
4645,0,0,2017,arson,NJ0134200,NJ,Rumson Police Department,MONMOUTH
4646,0,0,2017,arson,NJ0134300,NJ,Sea Bright Police Department,MONMOUTH
4647,0,0,2017,arson,NJ0134400,NJ,Sea Girt Police Department,MONMOUTH
4648,0,0,2017,arson,NJ0134500,NJ,Shrewsbury Police Department,MONMOUTH
4649,0,0,2017,arson,NJ0134700,NJ,Lake Como Police Department,MONMOUTH
4650,0,0,2017,arson,NJ0134800,NJ,Spring Lake Police Department,MONMOUTH
4651,0,0,2017,arson,NJ0134900,NJ,Spring Lake Heights Police Department,MONMOUTH
4652,0,0,2017,arson,NJ0135000,NJ,Union Beach Police Department,MONMOUTH
4653,0,0,2017,arson,NJ0135200,NJ,Wall Township Police Department,MONMOUTH
4654,0,0,2017,arson,NJ0135300,NJ,West Long Branch Police Department,MONMOUTH
4655,0,0,2017,arson,NJ013559E,NJ,Monmouth University,MONMOUTH
4656,0,0,2017,arson,NJ0135600,NJ,Brookdale Community College,MONMOUTH
4657,0,0,2017,arson,NJ013SP00,NJ,State Police: Monmouth County,MONMOUTH
4658,0,0,2017,arson,NJ0140100,NJ,Boonton Police Department,MORRIS
4659,0,0,2017,arson,NJ0140200,NJ,Boonton Township Police Department,MORRIS
4660,0,0,2017,arson,NJ0050200,NJ,Cape May Police Department,CAPE MAY
4661,0,0,2017,arson,NJ0050300,NJ,Cape May Point Police Department,CAPE MAY
4662,1,0,2017,arson,NJ0050500,NJ,Lower Township Police Department,CAPE MAY
4663,0,0,2017,arson,NJ0050600,NJ,Middle Township Police Department,CAPE MAY
4664,0,0,2017,arson,NJ0050700,NJ,North Wildwood Police Department,CAPE MAY
4665,0,0,2017,arson,NJ0050800,NJ,Ocean City Police Department,CAPE MAY
4666,0,0,2017,arson,NJ0050900,NJ,Sea Isle City Police Department,CAPE MAY
4667,0,0,2017,arson,NJ0051000,NJ,Stone Harbor Police Department,CAPE MAY
4668,0,0,2017,arson,NJ0051200,NJ,West Cape May Police Department,CAPE MAY
4669,0,0,2017,arson,NJ0051300,NJ,West Wildwood Police Department,CAPE MAY
4670,0,0,2017,arson,NJ0051400,NJ,Wildwood Police Department,CAPE MAY
4671,0,0,2017,arson,NJ0051500,NJ,Wildwood Crest Police Department,CAPE MAY
4672,2,0,2017,arson,NJ005SP00,NJ,State Police: Cape May County,CAPE MAY
4673,0,0,2017,arson,NJ0060000,NJ,Cumberland County Sheriff's Office,CUMBERLAND
4674,8,2,2017,arson,NJ0060100,NJ,Bridgeton Police Department,CUMBERLAND
4675,3,2,2017,arson,NJ0061000,NJ,Millville Police Department,CUMBERLAND
4676,12,3,2017,arson,NJ0061400,NJ,Vineland Police Department,CUMBERLAND
4677,1,1,2017,arson,NJ006SP00,NJ,State Police: Cumberland County,CUMBERLAND
4678,0,0,2017,arson,NJ0070000,NJ,Essex County Sheriff's Office,ESSEX
4679,0,0,2017,arson,NJ0070100,NJ,Belleville Police Department,ESSEX
4680,0,0,2017,arson,NJ0010100,NJ,Absecon Police Department,ATLANTIC
4681,2,1,2017,arson,NJ0010200,NJ,Atlantic City Police Department,ATLANTIC
4682,1,0,2017,arson,NJ0010300,NJ,Brigantine Police Department,ATLANTIC
4683,1,1,2017,arson,NJ0010400,NJ,Buena Police Department,ATLANTIC
4684,0,0,2017,arson,NJ0010700,NJ,Egg Harbor City Police Department,ATLANTIC
4685,6,4,2017,arson,NJ0010800,NJ,Egg Harbor Township Police Department,ATLANTIC
4686,1,0,2017,arson,NJ0011100,NJ,Galloway Township Police Department,ATLANTIC
4687,3,2,2017,arson,NJ0011200,NJ,"Hamilton Township, Atlantic County Police Department",ATLANTIC
4688,0,0,2017,arson,NJ0011300,NJ,Hammonton Police Department,ATLANTIC
4689,0,0,2017,arson,NJ0011400,NJ,Linwood Police Department,ATLANTIC
4690,0,0,2017,arson,NJ0011500,NJ,Longport Police Department,ATLANTIC
4691,1,1,2017,arson,NJ0011600,NJ,Margate City Police Department,ATLANTIC
4692,1,0,2017,arson,NJ0011700,NJ,Mullica Township Police Department,ATLANTIC
4693,0,0,2017,arson,NJ0011800,NJ,Northfield Police Department,ATLANTIC
4694,1,0,2017,arson,NJ0011900,NJ,Pleasantville Police Department,ATLANTIC
4695,0,0,2017,arson,NJ0012100,NJ,Somers Point Police Department,ATLANTIC
4696,1,1,2017,arson,NJ0012200,NJ,Ventnor City Police Department,ATLANTIC
4697,0,0,2017,arson,NJ0012400,NJ,Stockton University,ATLANTIC
4698,3,1,2017,arson,NJ001SP00,NJ,State Police: Atlantic County,ATLANTIC
4699,0,0,2017,arson,NJ0020000,NJ,Bergen County Sheriff's Office,BERGEN
4700,0,0,2017,arson,NJ0143300,NJ,Riverdale Police Department,MORRIS
4701,0,0,2017,arson,NJ0143400,NJ,Rockaway Police Department,MORRIS
4702,0,0,2017,arson,NJ0143500,NJ,Rockaway Township Police Department,MORRIS
4703,0,0,2017,arson,NJ0143600,NJ,Roxbury Township Police Department,MORRIS
4704,0,0,2017,arson,NJ0143800,NJ,"Washington Township, Morris County Police Department",MORRIS
4705,0,0,2017,arson,NJ0143900,NJ,Wharton Police Department,MORRIS
4706,0,0,2017,arson,NJ0149100,NJ,Park Police: Morris County,MORRIS
4707,0,0,2017,arson,NJ014SP00,NJ,State Police: Morris County,MORRIS
4708,0,0,2017,arson,NJ0150000,NJ,Ocean County Sheriff's Office,OCEAN
4709,0,0,2017,arson,NJ0150100,NJ,Barnegat Light Police Department,OCEAN
4710,0,0,2017,arson,NJ0150200,NJ,Bay Head Police Department,OCEAN
4711,0,0,2017,arson,NJ0150300,NJ,Beach Haven Police Department,OCEAN
4712,0,0,2017,arson,NJ0150400,NJ,Beachwood Police Department,OCEAN
4713,2,0,2017,arson,NJ0150500,NJ,Berkeley Township Police Department,OCEAN
4714,5,3,2017,arson,NJ0150600,NJ,Brick Township Police Department,OCEAN
4715,9,0,2017,arson,NJ0150700,NJ,Toms River Township Police Department,OCEAN
4716,0,0,2017,arson,NJ0150900,NJ,Harvey Cedars Police Department,OCEAN
4717,0,0,2017,arson,NJ0151000,NJ,Island Heights Police Department,OCEAN
4718,6,0,2017,arson,NJ0151100,NJ,Jackson Township Police Department,OCEAN
4719,0,0,2017,arson,NJ0151200,NJ,Lacey Township Police Department,OCEAN
4720,0,0,2017,arson,NJ0110600,NJ,Hopewell Township Police Department,MERCER
4721,2,1,2017,arson,NJ0110700,NJ,"Lawrence Township, Mercer County Police Department",MERCER
4722,0,0,2017,arson,NJ0110800,NJ,Pennington Police Department,MERCER
4723,3,1,2017,arson,NJ0111000,NJ,Princeton  Police Department,MERCER
4724,16,1,2017,arson,NJ0111100,NJ,Trenton Police Department,MERCER
4725,0,0,2017,arson,NJ0111200,NJ,Robbinsville Township Police Department,MERCER
4726,0,0,2017,arson,NJ0111300,NJ,West Windsor Township Police Department,MERCER
4727,5,4,2017,arson,NJ0111800,NJ,The College of New Jersey,MERCER
4728,0,0,2017,arson,NJ0115000,NJ,Princeton University,MERCER
4729,1,1,2017,arson,NJ011SP00,NJ,State Police: Mercer County,MERCER
4730,2,1,2017,arson,NJ0120100,NJ,Carteret Police Department,MIDDLESEX
4731,0,0,2017,arson,NJ0120200,NJ,Cranbury Township Police Department,MIDDLESEX
4732,3,1,2017,arson,NJ0120300,NJ,Dunellen Police Department,MIDDLESEX
4733,2,1,2017,arson,NJ0120400,NJ,East Brunswick Township Police Department,MIDDLESEX
4734,4,1,2017,arson,NJ0120500,NJ,Edison Township Police Department,MIDDLESEX
4735,0,0,2017,arson,NJ0120600,NJ,Helmetta Police Department,MIDDLESEX
4736,0,0,2017,arson,NJ0120700,NJ,Highland Park Police Department,MIDDLESEX
4737,1,1,2017,arson,NJ0120800,NJ,Jamesburg Police Department,MIDDLESEX
4738,1,1,2017,arson,NJ0120900,NJ,Old Bridge Township Police Department,MIDDLESEX
4739,0,0,2017,arson,NJ0121000,NJ,Metuchen Police Department,MIDDLESEX
4740,0,0,2017,arson,NJ0051000,NJ,Stone Harbor Police Department,CAPE MAY
4741,0,0,2017,arson,NJ0051200,NJ,West Cape May Police Department,CAPE MAY
4742,0,0,2017,arson,NJ0051300,NJ,West Wildwood Police Department,CAPE MAY
4743,0,0,2017,arson,NJ0051400,NJ,Wildwood Police Department,CAPE MAY
4744,0,0,2017,arson,NJ0051500,NJ,Wildwood Crest Police Department,CAPE MAY
4745,2,0,2017,arson,NJ005SP00,NJ,State Police: Cape May County,CAPE MAY
4746,0,0,2017,arson,NJ0060000,NJ,Cumberland County Sheriff's Office,CUMBERLAND
4747,8,2,2017,arson,NJ0060100,NJ,Bridgeton Police Department,CUMBERLAND
4748,3,2,2017,arson,NJ0061000,NJ,Millville Police Department,CUMBERLAND
4749,12,3,2017,arson,NJ0061400,NJ,Vineland Police Department,CUMBERLAND
4750,1,1,2017,arson,NJ006SP00,NJ,State Police: Cumberland County,CUMBERLAND
4751,0,0,2017,arson,NJ0070000,NJ,Essex County Sheriff's Office,ESSEX
4752,0,0,2017,arson,NJ0070100,NJ,Belleville Police Department,ESSEX
4753,1,0,2017,arson,NJ0070200,NJ,Bloomfield Police Department,ESSEX
4754,0,0,2017,arson,NJ0070300,NJ,Caldwell Police Department,ESSEX
4755,0,0,2017,arson,NJ0070400,NJ,"Fairfield Township, Essex County Police Department",ESSEX
4756,0,0,2017,arson,NJ0070500,NJ,Cedar Grove Township Police Department,ESSEX
4757,13,5,2017,arson,NJ0070600,NJ,East Orange Police Department,ESSEX
4758,0,0,2017,arson,NJ0070700,NJ,Essex Fells Police Department,ESSEX
4759,0,0,2017,arson,NJ0070800,NJ,Glen Ridge Police Department,ESSEX
4760,1,1,2017,arson,NJ002SP00,NJ,State Police: Bergen County,BERGEN
4761,1,1,2017,arson,NJ0030200,NJ,Beverly Police Department,BURLINGTON
4762,0,0,2017,arson,NJ0030300,NJ,Bordentown Police Department,BURLINGTON
4763,0,0,2017,arson,NJ0030400,NJ,Bordentown Township Police Department,BURLINGTON
4764,0,0,2017,arson,NJ0030500,NJ,Burlington Police Department,BURLINGTON
4765,1,1,2017,arson,NJ0030600,NJ,Burlington Township Police Department,BURLINGTON
4766,0,0,2017,arson,NJ0030700,NJ,Chesterfield Township Police Department,BURLINGTON
4767,1,0,2017,arson,NJ0030800,NJ,Cinnaminson Township Police Department,BURLINGTON
4768,0,0,2017,arson,NJ0030900,NJ,Delanco Township Police Department,BURLINGTON
4769,0,0,2017,arson,NJ0031000,NJ,Delran Township Police Department,BURLINGTON
4770,0,0,2017,arson,NJ0031100,NJ,Eastampton Township Police Department,BURLINGTON
4771,0,0,2017,arson,NJ0031200,NJ,Edgewater Park Township Police Department,BURLINGTON
4772,3,0,2017,arson,NJ0031300,NJ,Evesham Township Police Department,BURLINGTON
4773,0,0,2017,arson,NJ0031500,NJ,Florence Township Police Department,BURLINGTON
4774,6,1,2017,arson,NJ0031700,NJ,Willingboro Township Police Department,BURLINGTON
4775,0,0,2017,arson,NJ0031800,NJ,Lumberton Township Police Department,BURLINGTON
4776,0,0,2017,arson,NJ0031900,NJ,"Mansfield Township, Burlington County Police Department",BURLINGTON
4777,0,0,2017,arson,NJ0032000,NJ,Maple Shade Township Police Department,BURLINGTON
4778,1,0,2017,arson,NJ0032100,NJ,Medford Township Police Department,BURLINGTON
4779,0,0,2017,arson,NJ0032200,NJ,Medford Lakes Police Department,BURLINGTON
4780,0,0,2017,arson,NJ0020900,NJ,Demarest Police Department,BERGEN
4781,0,0,2017,arson,NJ0021000,NJ,Dumont Police Department,BERGEN
4782,1,1,2017,arson,NJ0021100,NJ,Elmwood Park Police Department,BERGEN
4783,0,0,2017,arson,NJ0021200,NJ,East Rutherford Police Department,BERGEN
4784,0,0,2017,arson,NJ0021300,NJ,Edgewater Police Department,BERGEN
4785,0,0,2017,arson,NJ0021400,NJ,Emerson Police Department,BERGEN
4786,0,0,2017,arson,NJ0021500,NJ,Englewood Police Department,BERGEN
4787,0,0,2017,arson,NJ0021600,NJ,Englewood Cliffs Police Department,BERGEN
4788,3,1,2017,arson,NJ0021700,NJ,Fair Lawn Police Department,BERGEN
4789,0,0,2017,arson,NJ0021800,NJ,Fairview Police Department,BERGEN
4790,0,0,2017,arson,NJ0021900,NJ,Fort Lee Police Department,BERGEN
4791,0,0,2017,arson,NJ0022000,NJ,Franklin Lakes Police Department,BERGEN
4792,3,3,2017,arson,NJ0022100,NJ,Garfield Police Department,BERGEN
4793,0,0,2017,arson,NJ0022200,NJ,Glen Rock Police Department,BERGEN
4794,4,2,2017,arson,NJ0022300,NJ,Hackensack Police Department,BERGEN
4795,0,0,2017,arson,NJ0022400,NJ,Harrington Park Police Department,BERGEN
4796,0,0,2017,arson,NJ0022500,NJ,Hasbrouck Heights Police Department,BERGEN
4797,0,0,2017,arson,NJ0022600,NJ,Haworth Police Department,BERGEN
4798,0,0,2017,arson,NJ0022700,NJ,Hillsdale Police Department,BERGEN
4799,0,0,2017,arson,NJ0022800,NJ,Ho-Ho-Kus Police Department,BERGEN
4800,0,0,2017,arson,NJ0211200,NJ,Independence Township Police Department,WARREN
4801,0,0,2017,arson,NJ0211500,NJ,Lopatcong Township Police Department,WARREN
4802,0,0,2017,arson,NJ0211600,NJ,"Mansfield Township, Warren County Police Department",WARREN
4803,0,0,2017,arson,NJ0211700,NJ,Oxford Township Police Department,WARREN
4804,3,1,2017,arson,NJ0211900,NJ,Phillipsburg Police Department,WARREN
4805,0,0,2017,arson,NJ0212000,NJ,Pohatcong Township Police Department,WARREN
4806,0,0,2017,arson,NJ0212100,NJ,Washington Police Department,WARREN
4807,0,0,2017,arson,NJ0212200,NJ,"Washington Township, Warren County Police Department",WARREN
4808,0,0,2017,arson,NJ021SP00,NJ,State Police: Warren County,WARREN
4809,72,4,2017,arson,NJNPD0000,NJ,Newark Police Department,ESSEX
4810,0,0,2017,arson,NJNPIPP00,NJ,Palisades Interstate Parkway,BERGEN
4811,0,0,2017,arson,NJNYPOA00,NJ,Port Authority of New York and New Jersey,N/A
4812,0,0,2017,arson,NJ0010000,NJ,Atlantic County Sheriff's Office,ATLANTIC
4813,0,0,2017,arson,NJ0010100,NJ,Absecon Police Department,ATLANTIC
4814,2,1,2017,arson,NJ0010200,NJ,Atlantic City Police Department,ATLANTIC
4815,1,0,2017,arson,NJ0010300,NJ,Brigantine Police Department,ATLANTIC
4816,1,1,2017,arson,NJ0010400,NJ,Buena Police Department,ATLANTIC
4817,0,0,2017,arson,NJ0010700,NJ,Egg Harbor City Police Department,ATLANTIC
4818,6,4,2017,arson,NJ0010800,NJ,Egg Harbor Township Police Department,ATLANTIC
4819,1,0,2017,arson,NJ0011100,NJ,Galloway Township Police Department,ATLANTIC
4820,1,1,2017,arson,NJ0200900,NJ,Linden Police Department,UNION
4821,0,0,2017,arson,NJ0201000,NJ,Mountainside Police Department,UNION
4822,0,0,2017,arson,NJ0201100,NJ,New Providence Police Department,UNION
4823,4,1,2017,arson,NJ0201200,NJ,Plainfield Police Department,UNION
4824,1,1,2017,arson,NJ0201300,NJ,Rahway Police Department,UNION
4825,2,0,2017,arson,NJ0201400,NJ,Roselle Police Department,UNION
4826,0,0,2017,arson,NJ0201500,NJ,Roselle Park Police Department,UNION
4827,0,0,2017,arson,NJ0201600,NJ,Scotch Plains Township Police Department,UNION
4828,0,0,2017,arson,NJ0201700,NJ,Springfield Police Department,UNION
4829,0,0,2017,arson,NJ0201800,NJ,Summit Police Department,UNION
4830,1,1,2017,arson,NJ0201900,NJ,Union Township Police Department,UNION
4831,0,0,2017,arson,NJ0202000,NJ,Westfield Police Department,UNION
4832,0,0,2017,arson,NJ0202100,NJ,Winfield Township Police Department,UNION
4833,0,0,2017,arson,NJ0202400,NJ,Kean University,UNION
4834,0,0,2017,arson,NJ0209100,NJ,Park Police: Union County,UNION
4835,0,0,2017,arson,NJ020SP00,NJ,State Police: Union County,UNION
4836,0,0,2017,arson,NJ0210200,NJ,Alpha Police Department,WARREN
4837,0,0,2017,arson,NJ0210300,NJ,Belvidere Police Department,WARREN
4838,0,0,2017,arson,NJ0210400,NJ,Blairstown Township Police Department,WARREN
4839,1,1,2017,arson,NJ0210700,NJ,"Greenwich Township, Warren County Police Department",WARREN
4840,0,0,2017,arson,NJ0200700,NJ,Hillside Township Police Department,UNION
4841,0,0,2017,arson,NJ0200800,NJ,Kenilworth Police Department,UNION
4842,1,1,2017,arson,NJ0200900,NJ,Linden Police Department,UNION
4843,0,0,2017,arson,NJ0201000,NJ,Mountainside Police Department,UNION
4844,0,0,2017,arson,NJ0201100,NJ,New Providence Police Department,UNION
4845,4,1,2017,arson,NJ0201200,NJ,Plainfield Police Department,UNION
4846,1,1,2017,arson,NJ0201300,NJ,Rahway Police Department,UNION
4847,2,0,2017,arson,NJ0201400,NJ,Roselle Police Department,UNION
4848,0,0,2017,arson,NJ0201500,NJ,Roselle Park Police Department,UNION
4849,0,0,2017,arson,NJ0201600,NJ,Scotch Plains Township Police Department,UNION
4850,0,0,2017,arson,NJ0201700,NJ,Springfield Police Department,UNION
4851,0,0,2017,arson,NJ0201800,NJ,Summit Police Department,UNION
4852,1,1,2017,arson,NJ0201900,NJ,Union Township Police Department,UNION
4853,0,0,2017,arson,NJ0202000,NJ,Westfield Police Department,UNION
4854,0,0,2017,arson,NJ0202100,NJ,Winfield Township Police Department,UNION
4855,0,0,2017,arson,NJ0202400,NJ,Kean University,UNION
4856,0,0,2017,arson,NJ0209100,NJ,Park Police: Union County,UNION
4857,0,0,2017,arson,NJ020SP00,NJ,State Police: Union County,UNION
4858,0,0,2017,arson,NJ0210200,NJ,Alpha Police Department,WARREN
4859,0,0,2017,arson,NJ0210300,NJ,Belvidere Police Department,WARREN
4860,1,0,2017,violent-crime,NJ0010000,NJ,Atlantic County Sheriff's Office,ATLANTIC
4861,11,4,2017,violent-crime,NJ0010100,NJ,Absecon Police Department,ATLANTIC
4862,425,84,2017,violent-crime,NJ0010200,NJ,Atlantic City Police Department,ATLANTIC
4863,2,2,2017,violent-crime,NJ0010300,NJ,Brigantine Police Department,ATLANTIC
4864,14,3,2017,violent-crime,NJ0010400,NJ,Buena Police Department,ATLANTIC
4865,15,5,2017,violent-crime,NJ0010700,NJ,Egg Harbor City Police Department,ATLANTIC
4866,55,45,2017,violent-crime,NJ0010800,NJ,Egg Harbor Township Police Department,ATLANTIC
4867,73,34,2017,violent-crime,NJ0011100,NJ,Galloway Township Police Department,ATLANTIC
4868,37,26,2017,violent-crime,NJ0011200,NJ,"Hamilton Township, Atlantic County Police Department",ATLANTIC
4869,17,11,2017,violent-crime,NJ0011300,NJ,Hammonton Police Department,ATLANTIC
4870,1,1,2017,violent-crime,NJ0011400,NJ,Linwood Police Department,ATLANTIC
4871,2,1,2017,violent-crime,NJ0011500,NJ,Longport Police Department,ATLANTIC
4872,4,3,2017,violent-crime,NJ0011600,NJ,Margate City Police Department,ATLANTIC
4873,3,3,2017,violent-crime,NJ0011700,NJ,Mullica Township Police Department,ATLANTIC
4874,0,0,2017,violent-crime,NJ0011800,NJ,Northfield Police Department,ATLANTIC
4875,116,38,2017,violent-crime,NJ0011900,NJ,Pleasantville Police Department,ATLANTIC
4876,21,9,2017,violent-crime,NJ0012100,NJ,Somers Point Police Department,ATLANTIC
4877,6,6,2017,violent-crime,NJ0012200,NJ,Ventnor City Police Department,ATLANTIC
4878,4,0,2017,violent-crime,NJ0012400,NJ,Stockton University,ATLANTIC
4879,40,11,2017,violent-crime,NJ001SP00,NJ,State Police: Atlantic County,ATLANTIC
4880,0,0,2017,violent-crime,NJ0021600,NJ,Englewood Cliffs Police Department,BERGEN
4881,23,21,2017,violent-crime,NJ0021700,NJ,Fair Lawn Police Department,BERGEN
4882,21,14,2017,violent-crime,NJ0021800,NJ,Fairview Police Department,BERGEN
4883,26,17,2017,violent-crime,NJ0021900,NJ,Fort Lee Police Department,BERGEN
4884,1,1,2017,violent-crime,NJ0022000,NJ,Franklin Lakes Police Department,BERGEN
4885,59,40,2017,violent-crime,NJ0022100,NJ,Garfield Police Department,BERGEN
4886,2,1,2017,violent-crime,NJ0022200,NJ,Glen Rock Police Department,BERGEN
4887,94,49,2017,violent-crime,NJ0022300,NJ,Hackensack Police Department,BERGEN
4888,1,1,2017,violent-crime,NJ0022400,NJ,Harrington Park Police Department,BERGEN
4889,2,3,2017,violent-crime,NJ0022500,NJ,Hasbrouck Heights Police Department,BERGEN
4890,0,0,2017,violent-crime,NJ0022600,NJ,Haworth Police Department,BERGEN
4891,0,0,2017,violent-crime,NJ0022700,NJ,Hillsdale Police Department,BERGEN
4892,2,1,2017,violent-crime,NJ0022800,NJ,Ho-Ho-Kus Police Department,BERGEN
4893,3,2,2017,violent-crime,NJ0022900,NJ,Leonia Police Department,BERGEN
4894,11,7,2017,violent-crime,NJ0023000,NJ,Little Ferry Police Department,BERGEN
4895,43,26,2017,violent-crime,NJ0023100,NJ,Lodi Police Department,BERGEN
4896,9,6,2017,violent-crime,NJ0023200,NJ,Lyndhurst Township Police Department,BERGEN
4897,9,7,2017,violent-crime,NJ0023300,NJ,Mahwah Township Police Department,BERGEN
4898,4,4,2017,violent-crime,NJ0023400,NJ,Maywood Police Department,BERGEN
4899,4,4,2017,violent-crime,NJ0023500,NJ,Midland Park Police Department,BERGEN
4900,12,4,2017,violent-crime,NJ0030400,NJ,Bordentown Township Police Department,BURLINGTON
4901,45,14,2017,violent-crime,NJ0030500,NJ,Burlington Police Department,BURLINGTON
4902,34,25,2017,violent-crime,NJ0030600,NJ,Burlington Township Police Department,BURLINGTON
4903,0,0,2017,violent-crime,NJ0030700,NJ,Chesterfield Township Police Department,BURLINGTON
4904,8,5,2017,violent-crime,NJ0030800,NJ,Cinnaminson Township Police Department,BURLINGTON
4905,4,1,2017,violent-crime,NJ0030900,NJ,Delanco Township Police Department,BURLINGTON
4906,11,3,2017,violent-crime,NJ0031000,NJ,Delran Township Police Department,BURLINGTON
4907,3,1,2017,violent-crime,NJ0031100,NJ,Eastampton Township Police Department,BURLINGTON
4908,13,4,2017,violent-crime,NJ0031200,NJ,Edgewater Park Township Police Department,BURLINGTON
4909,28,17,2017,violent-crime,NJ0031300,NJ,Evesham Township Police Department,BURLINGTON
4910,19,11,2017,violent-crime,NJ0031500,NJ,Florence Township Police Department,BURLINGTON
4911,92,36,2017,violent-crime,NJ0031700,NJ,Willingboro Township Police Department,BURLINGTON
4912,23,13,2017,violent-crime,NJ0031800,NJ,Lumberton Township Police Department,BURLINGTON
4913,5,4,2017,violent-crime,NJ0031900,NJ,"Mansfield Township, Burlington County Police Department",BURLINGTON
4914,31,13,2017,violent-crime,NJ0032000,NJ,Maple Shade Township Police Department,BURLINGTON
4915,16,7,2017,violent-crime,NJ0032100,NJ,Medford Township Police Department,BURLINGTON
4916,0,0,2017,violent-crime,NJ0032200,NJ,Medford Lakes Police Department,BURLINGTON
4917,10,3,2017,violent-crime,NJ0032300,NJ,Moorestown Township Police Department,BURLINGTON
4918,42,12,2017,violent-crime,NJ0032400,NJ,Mount Holly Township Police Department,BURLINGTON
4919,38,14,2017,violent-crime,NJ0032500,NJ,Mount Laurel Township Police Department,BURLINGTON
4920,1,0,2017,violent-crime,NJ0051000,NJ,Stone Harbor Police Department,CAPE MAY
4921,0,0,2017,violent-crime,NJ0051200,NJ,West Cape May Police Department,CAPE MAY
4922,2,2,2017,violent-crime,NJ0051300,NJ,West Wildwood Police Department,CAPE MAY
4923,65,23,2017,violent-crime,NJ0051400,NJ,Wildwood Police Department,CAPE MAY
4924,9,9,2017,violent-crime,NJ0051500,NJ,Wildwood Crest Police Department,CAPE MAY
4925,20,15,2017,violent-crime,NJ005SP00,NJ,State Police: Cape May County,CAPE MAY
4926,0,0,2017,violent-crime,NJ0060000,NJ,Cumberland County Sheriff's Office,CUMBERLAND
4927,272,37,2017,violent-crime,NJ0060100,NJ,Bridgeton Police Department,CUMBERLAND
4928,160,55,2017,violent-crime,NJ0061000,NJ,Millville Police Department,CUMBERLAND
4929,298,147,2017,violent-crime,NJ0061400,NJ,Vineland Police Department,CUMBERLAND
4930,72,39,2017,violent-crime,NJ006SP00,NJ,State Police: Cumberland County,CUMBERLAND
4931,65,10,2017,violent-crime,NJ0070000,NJ,Essex County Sheriff's Office,ESSEX
4932,81,32,2017,violent-crime,NJ0070100,NJ,Belleville Police Department,ESSEX
4933,57,25,2017,violent-crime,NJ0070200,NJ,Bloomfield Police Department,ESSEX
4934,8,1,2017,violent-crime,NJ0070300,NJ,Caldwell Police Department,ESSEX
4935,4,2,2017,violent-crime,NJ0070400,NJ,"Fairfield Township, Essex County Police Department",ESSEX
4936,4,4,2017,violent-crime,NJ0070500,NJ,Cedar Grove Township Police Department,ESSEX
4937,473,217,2017,violent-crime,NJ0070600,NJ,East Orange Police Department,ESSEX
4938,0,0,2017,violent-crime,NJ0070700,NJ,Essex Fells Police Department,ESSEX
4939,7,4,2017,violent-crime,NJ0070800,NJ,Glen Ridge Police Department,ESSEX
4940,126,65,2017,violent-crime,NJ0110300,NJ,"Hamilton Township, Mercer County Police Department",MERCER
4941,5,4,2017,violent-crime,NJ0110400,NJ,Hightstown Police Department,MERCER
4942,2,1,2017,violent-crime,NJ0110500,NJ,Hopewell Police Department,MERCER
4943,7,1,2017,violent-crime,NJ0110600,NJ,Hopewell Township Police Department,MERCER
4944,19,19,2017,violent-crime,NJ0110700,NJ,"Lawrence Township, Mercer County Police Department",MERCER
4945,0,0,2017,violent-crime,NJ0110800,NJ,Pennington Police Department,MERCER
4946,7,6,2017,violent-crime,NJ0111000,NJ,Princeton  Police Department,MERCER
4947,1083,363,2017,violent-crime,NJ0111100,NJ,Trenton Police Department,MERCER
4948,1,1,2017,violent-crime,NJ0111200,NJ,Robbinsville Township Police Department,MERCER
4949,21,14,2017,violent-crime,NJ0111300,NJ,West Windsor Township Police Department,MERCER
4950,2,1,2017,violent-crime,NJ0111800,NJ,The College of New Jersey,MERCER
4951,3,1,2017,violent-crime,NJ0115000,NJ,Princeton University,MERCER
4952,7,0,2017,violent-crime,NJ011SP00,NJ,State Police: Mercer County,MERCER
4953,44,23,2017,violent-crime,NJ0120100,NJ,Carteret Police Department,MIDDLESEX
4954,0,0,2017,violent-crime,NJ0120200,NJ,Cranbury Township Police Department,MIDDLESEX
4955,10,5,2017,violent-crime,NJ0120300,NJ,Dunellen Police Department,MIDDLESEX
4956,24,16,2017,violent-crime,NJ0120400,NJ,East Brunswick Township Police Department,MIDDLESEX
4957,112,57,2017,violent-crime,NJ0120500,NJ,Edison Township Police Department,MIDDLESEX
4958,1,1,2017,violent-crime,NJ0120600,NJ,Helmetta Police Department,MIDDLESEX
4959,5,3,2017,violent-crime,NJ0120700,NJ,Highland Park Police Department,MIDDLESEX
4960,1,1,2017,violent-crime,NJ0142600,NJ,Mount Arlington Police Department,MORRIS
4961,9,7,2017,violent-crime,NJ0142700,NJ,Mount Olive Township Police Department,MORRIS
4962,5,0,2017,violent-crime,NJ0142800,NJ,Netcong Police Department,MORRIS
4963,36,14,2017,violent-crime,NJ0142900,NJ,Parsippany-Troy Hills Township Police Department,MORRIS
4964,1,0,2017,violent-crime,NJ0143000,NJ,Long Hill Township Police Department,MORRIS
4965,1,1,2017,violent-crime,NJ0143100,NJ,Pequannock Township Police Department,MORRIS
4966,4,4,2017,violent-crime,NJ0143200,NJ,Randolph Township Police Department,MORRIS
4967,1,1,2017,violent-crime,NJ0143300,NJ,Riverdale Police Department,MORRIS
4968,1,1,2017,violent-crime,NJ0143400,NJ,Rockaway Police Department,MORRIS
4969,11,5,2017,violent-crime,NJ0143500,NJ,Rockaway Township Police Department,MORRIS
4970,5,3,2017,violent-crime,NJ0143600,NJ,Roxbury Township Police Department,MORRIS
4971,3,1,2017,violent-crime,NJ0143800,NJ,"Washington Township, Morris County Police Department",MORRIS
4972,4,4,2017,violent-crime,NJ0143900,NJ,Wharton Police Department,MORRIS
4973,0,0,2017,violent-crime,NJ0149100,NJ,Park Police: Morris County,MORRIS
4974,6,2,2017,violent-crime,NJ014SP00,NJ,State Police: Morris County,MORRIS
4975,0,0,2017,violent-crime,NJ0150000,NJ,Ocean County Sheriff's Office,OCEAN
4976,1,0,2017,violent-crime,NJ0150100,NJ,Barnegat Light Police Department,OCEAN
4977,0,0,2017,violent-crime,NJ0150200,NJ,Bay Head Police Department,OCEAN
4978,2,1,2017,violent-crime,NJ0150300,NJ,Beach Haven Police Department,OCEAN
4979,6,2,2017,violent-crime,NJ0150400,NJ,Beachwood Police Department,OCEAN
