,actual,cleared,data_year,offense,ori,state_abbr,agency_name,county_name
1292,332,78,2017,larceny,NJ0042200,NJ,Lindenwold Police Department,CAMDEN
1293,70,7,2017,larceny,NJ0042300,NJ,Magnolia Police Department,CAMDEN
1294,48,6,2017,larceny,NJ0042400,NJ,Merchantville Police Department,CAMDEN
1295,174,60,2017,larceny,NJ0042500,NJ,Mount Ephraim Police Department,CAMDEN
1296,121,35,2017,larceny,NJ0042600,NJ,Oaklyn Police Department,CAMDEN
1297,556,54,2017,larceny,NJ0042700,NJ,Pennsauken Township Police Department,CAMDEN
1298,170,15,2017,larceny,NJ0042800,NJ,Pine Hill Police Department,CAMDEN
1299,198,55,2017,larceny,NJ0043000,NJ,Runnemede Police Department,CAMDEN
1300,139,23,2017,larceny,NJ0140900,NJ,Dover Police Department,MORRIS
1301,174,9,2017,larceny,NJ0141000,NJ,East Hanover Township Police Department,MORRIS
1302,69,13,2017,larceny,NJ0141100,NJ,Florham Park Police Department,MORRIS
1303,153,49,2017,larceny,NJ0141200,NJ,Hanover Township Police Department,MORRIS
1304,6,0,2017,larceny,NJ0141300,NJ,Harding Township Police Department,MORRIS
1305,65,1,2017,larceny,NJ0141400,NJ,Jefferson Township Police Department,MORRIS
1306,22,3,2017,larceny,NJ0141500,NJ,Kinnelon Police Department,MORRIS
1307,47,14,2017,larceny,NJ0141600,NJ,Lincoln Park Police Department,MORRIS
1308,52,7,2017,larceny,NJ0141700,NJ,Madison Police Department,MORRIS
1309,7,0,2017,larceny,NJ0141800,NJ,Mendham Police Department,MORRIS
1310,3,0,2017,larceny,NJ0141900,NJ,Mendham Township Police Department,MORRIS
1311,18,4,2017,larceny,NJ0142000,NJ,Mine Hill Township Police Department,MORRIS
1312,115,11,2017,larceny,NJ0142100,NJ,Montville Township Police Department,MORRIS
1313,75,2,2017,larceny,NJ0142200,NJ,Morris Township Police Department,MORRIS
1314,47,12,2017,larceny,NJ0142300,NJ,Morris Plains Police Department,MORRIS
1315,237,26,2017,larceny,NJ0142400,NJ,Morristown Police Department,MORRIS
1316,25,0,2017,larceny,NJ0142500,NJ,Mountain Lakes Police Department,MORRIS
1317,42,16,2017,larceny,NJ0142600,NJ,Mount Arlington Police Department,MORRIS
1318,134,35,2017,larceny,NJ0142700,NJ,Mount Olive Township Police Department,MORRIS
1319,36,10,2017,larceny,NJ0142800,NJ,Netcong Police Department,MORRIS
1320,38,12,2017,larceny,NJ002SP00,NJ,State Police: Bergen County,BERGEN
1321,26,8,2017,larceny,NJ0030200,NJ,Beverly Police Department,BURLINGTON
1322,22,5,2017,larceny,NJ0030300,NJ,Bordentown Police Department,BURLINGTON
1323,94,22,2017,larceny,NJ0030400,NJ,Bordentown Township Police Department,BURLINGTON
1324,190,21,2017,larceny,NJ0030500,NJ,Burlington Police Department,BURLINGTON
1325,235,104,2017,larceny,NJ0030600,NJ,Burlington Township Police Department,BURLINGTON
1326,21,2,2017,larceny,NJ0030700,NJ,Chesterfield Township Police Department,BURLINGTON
1327,278,87,2017,larceny,NJ0030800,NJ,Cinnaminson Township Police Department,BURLINGTON
1328,59,12,2017,larceny,NJ0030900,NJ,Delanco Township Police Department,BURLINGTON
1329,230,34,2017,larceny,NJ0031000,NJ,Delran Township Police Department,BURLINGTON
1330,60,0,2017,larceny,NJ0031100,NJ,Eastampton Township Police Department,BURLINGTON
1331,87,17,2017,larceny,NJ0031200,NJ,Edgewater Park Township Police Department,BURLINGTON
1332,476,90,2017,larceny,NJ0031300,NJ,Evesham Township Police Department,BURLINGTON
1333,56,14,2017,larceny,NJ0031500,NJ,Florence Township Police Department,BURLINGTON
1334,354,30,2017,larceny,NJ0031700,NJ,Willingboro Township Police Department,BURLINGTON
1335,191,21,2017,larceny,NJ0031800,NJ,Lumberton Township Police Department,BURLINGTON
1336,49,7,2017,larceny,NJ0031900,NJ,"Mansfield Township, Burlington County Police Department",BURLINGTON
1337,326,25,2017,larceny,NJ0032000,NJ,Maple Shade Township Police Department,BURLINGTON
1338,108,20,2017,larceny,NJ0032100,NJ,Medford Township Police Department,BURLINGTON
1339,22,2,2017,larceny,NJ0032200,NJ,Medford Lakes Police Department,BURLINGTON
1340,19,4,2017,larceny,NJ0140600,NJ,Chester Police Department,MORRIS
1341,32,0,2017,larceny,NJ0140700,NJ,Chester Township Police Department,MORRIS
1342,62,16,2017,larceny,NJ0140800,NJ,Denville Township Police Department,MORRIS
1343,139,23,2017,larceny,NJ0140900,NJ,Dover Police Department,MORRIS
1344,174,9,2017,larceny,NJ0141000,NJ,East Hanover Township Police Department,MORRIS
1345,69,13,2017,larceny,NJ0141100,NJ,Florham Park Police Department,MORRIS
1346,153,49,2017,larceny,NJ0141200,NJ,Hanover Township Police Department,MORRIS
1347,6,0,2017,larceny,NJ0141300,NJ,Harding Township Police Department,MORRIS
1348,65,1,2017,larceny,NJ0141400,NJ,Jefferson Township Police Department,MORRIS
1349,22,3,2017,larceny,NJ0141500,NJ,Kinnelon Police Department,MORRIS
1350,47,14,2017,larceny,NJ0141600,NJ,Lincoln Park Police Department,MORRIS
1351,52,7,2017,larceny,NJ0141700,NJ,Madison Police Department,MORRIS
1352,7,0,2017,larceny,NJ0141800,NJ,Mendham Police Department,MORRIS
1353,3,0,2017,larceny,NJ0141900,NJ,Mendham Township Police Department,MORRIS
1354,18,4,2017,larceny,NJ0142000,NJ,Mine Hill Township Police Department,MORRIS
1355,115,11,2017,larceny,NJ0142100,NJ,Montville Township Police Department,MORRIS
1356,75,2,2017,larceny,NJ0142200,NJ,Morris Township Police Department,MORRIS
1357,47,12,2017,larceny,NJ0142300,NJ,Morris Plains Police Department,MORRIS
1358,237,26,2017,larceny,NJ0142400,NJ,Morristown Police Department,MORRIS
1359,25,0,2017,larceny,NJ0142500,NJ,Mountain Lakes Police Department,MORRIS
1360,150,19,2017,larceny,NJ0040400,NJ,Bellmawr Police Department,CAMDEN
1361,107,30,2017,larceny,NJ0040500,NJ,Berlin Police Department,CAMDEN
1362,123,49,2017,larceny,NJ0040600,NJ,Berlin Township Police Department,CAMDEN
1363,178,79,2017,larceny,NJ0040700,NJ,Brooklawn Police Department,CAMDEN
1364,1393,242,2017,larceny,NJ0040800,NJ,Camden County Police Department,CAMDEN
1365,8,0,2017,larceny,NJ0040900,NJ,Chesilhurst Police Department,CAMDEN
1366,105,9,2017,larceny,NJ0041000,NJ,Clementon Police Department,CAMDEN
1367,263,45,2017,larceny,NJ0041100,NJ,Collingswood Police Department,CAMDEN
1368,1849,671,2017,larceny,NJ0041200,NJ,Cherry Hill Township Police Department,CAMDEN
1369,27,0,2017,larceny,NJ0041300,NJ,Gibbsboro Police Department,CAMDEN
1370,215,24,2017,larceny,NJ0041400,NJ,Gloucester City Police Department,CAMDEN
1371,922,241,2017,larceny,NJ0041500,NJ,Gloucester Township Police Department,CAMDEN
1372,258,93,2017,larceny,NJ0041600,NJ,Haddon Township Police Department,CAMDEN
1373,146,18,2017,larceny,NJ0041700,NJ,Haddonfield Police Department,CAMDEN
1374,53,6,2017,larceny,NJ0041800,NJ,Haddon Heights Police Department,CAMDEN
1375,10,1,2017,larceny,NJ0041900,NJ,Hi-Nella Police Department,CAMDEN
1376,19,0,2017,larceny,NJ0042000,NJ,Laurel Springs Police Department,CAMDEN
1377,102,46,2017,larceny,NJ0042100,NJ,Lawnside Police Department,CAMDEN
1378,332,78,2017,larceny,NJ0042200,NJ,Lindenwold Police Department,CAMDEN
1379,70,7,2017,larceny,NJ0042300,NJ,Magnolia Police Department,CAMDEN
1380,79,5,2017,larceny,NJ0160900,NJ,Pompton Lakes Police Department,PASSAIC
1381,72,0,2017,larceny,NJ0161000,NJ,Prospect Park Police Department,PASSAIC
1382,19,6,2017,larceny,NJ0161100,NJ,Ringwood Police Department,PASSAIC
1383,243,57,2017,larceny,NJ0161200,NJ,Totowa Police Department,PASSAIC
1384,69,5,2017,larceny,NJ0161300,NJ,Wanaque Police Department,PASSAIC
1385,851,304,2017,larceny,NJ0161400,NJ,Wayne Township Police Department,PASSAIC
1386,155,24,2017,larceny,NJ0161500,NJ,West Milford Township Police Department,PASSAIC
1387,133,18,2017,larceny,NJ0161600,NJ,Woodland Park Police Department,PASSAIC
1388,53,2,2017,larceny,NJ0161700,NJ,William Paterson University,PASSAIC
1389,6,0,2017,larceny,NJ016SP00,NJ,State Police: Passaic County,PASSAIC
1390,0,0,2017,larceny,NJ0170000,NJ,Salem County Sheriff's Office,SALEM
1391,2,0,2017,larceny,NJ0170200,NJ,Elmer Police Department,SALEM
1392,8,2,2017,larceny,NJ0170300,NJ,Elsinboro Township Police Department,SALEM
1393,8,2,2017,larceny,NJ0170400,NJ,Lower Alloways Creek Township Police Department,SALEM
1394,175,71,2017,larceny,NJ0170500,NJ,Pennsville Township Police Department,SALEM
1395,185,63,2017,larceny,NJ0170800,NJ,Penns Grove Police Department,SALEM
1396,120,27,2017,larceny,NJ0171200,NJ,Salem Police Department,SALEM
1397,110,13,2017,larceny,NJ0171300,NJ,Carney's Point Township Police Department,SALEM
1398,31,5,2017,larceny,NJ0171500,NJ,Woodstown Police Department,SALEM
1399,131,69,2017,larceny,NJ017SP00,NJ,State Police: Salem County,SALEM
1400,503,184,2017,larceny,NJ0090700,NJ,Kearny Police Department,HUDSON
1401,364,114,2017,larceny,NJ0090800,NJ,North Bergen Township Police Department,HUDSON
1402,389,81,2017,larceny,NJ0090900,NJ,Secaucus Police Department,HUDSON
1403,1028,65,2017,larceny,NJ0091000,NJ,Union City Police Department,HUDSON
1404,253,41,2017,larceny,NJ0091100,NJ,Weehawken Township Police Department,HUDSON
1405,409,32,2017,larceny,NJ0091200,NJ,West New York Police Department,HUDSON
1406,23,0,2017,larceny,NJ009149E,NJ,Stevens Institute of Technology,HUDSON
1407,6,2,2017,larceny,NJ009SP00,NJ,State Police: Hudson County,HUDSON
1408,1,0,2017,larceny,NJ0100400,NJ,Califon Police Department,HUNTERDON
1409,9,5,2017,larceny,NJ0100500,NJ,Clinton Police Department,HUNTERDON
1410,42,8,2017,larceny,NJ0100600,NJ,Clinton Township Police Department,HUNTERDON
1411,12,11,2017,larceny,NJ0100700,NJ,Delaware Township Police Department,HUNTERDON
1412,72,11,2017,larceny,NJ0100900,NJ,Flemington Police Department,HUNTERDON
1413,17,11,2017,larceny,NJ0101000,NJ,"Franklin Township, Hunterdon County Police Department",HUNTERDON
1414,10,0,2017,larceny,NJ0101100,NJ,Frenchtown Police Department,HUNTERDON
1415,16,0,2017,larceny,NJ0101400,NJ,High Bridge Police Department,HUNTERDON
1416,7,3,2017,larceny,NJ0101500,NJ,Holland Township Police Department,HUNTERDON
1417,37,5,2017,larceny,NJ0101700,NJ,Lambertville Police Department,HUNTERDON
1418,12,2,2017,larceny,NJ0101900,NJ,Lebanon Township Police Department,HUNTERDON
1419,78,28,2017,larceny,NJ0102100,NJ,Raritan Township Police Department,HUNTERDON
1420,65,12,2017,larceny,NJ0024200,NJ,Oakland Police Department,BERGEN
1421,8,0,2017,larceny,NJ0024300,NJ,Old Tappan Police Department,BERGEN
1422,16,2,2017,larceny,NJ0024400,NJ,Oradell Police Department,BERGEN
1423,88,14,2017,larceny,NJ0024500,NJ,Palisades Park Police Department,BERGEN
1424,1095,486,2017,larceny,NJ0024600,NJ,Paramus Police Department,BERGEN
1425,9,0,2017,larceny,NJ0024700,NJ,Park Ridge Police Department,BERGEN
1426,129,15,2017,larceny,NJ0024800,NJ,Ramsey Police Department,BERGEN
1427,55,0,2017,larceny,NJ0024900,NJ,Ridgefield Police Department,BERGEN
1428,137,17,2017,larceny,NJ0025000,NJ,Ridgefield Park Police Department,BERGEN
1429,152,17,2017,larceny,NJ0025100,NJ,Ridgewood Police Department,BERGEN
1430,49,7,2017,larceny,NJ0025200,NJ,River Edge Police Department,BERGEN
1431,12,3,2017,larceny,NJ0025300,NJ,River Vale Township Police Department,BERGEN
1432,74,12,2017,larceny,NJ0025400,NJ,Rochelle Park Township Police Department,BERGEN
1433,0,0,2017,larceny,NJ0025500,NJ,Rockleigh Police Department,BERGEN
1434,166,21,2017,larceny,NJ0025600,NJ,Rutherford Police Department,BERGEN
1435,190,69,2017,larceny,NJ0025700,NJ,Saddle Brook Township Police Department,BERGEN
1436,13,4,2017,larceny,NJ0025800,NJ,Saddle River Police Department,BERGEN
1437,48,16,2017,larceny,NJ0025900,NJ,South Hackensack Township Police Department,BERGEN
1438,299,25,2017,larceny,NJ0026000,NJ,Teaneck Township Police Department,BERGEN
1439,48,8,2017,larceny,NJ0026100,NJ,Tenafly Police Department,BERGEN
1440,1086,198,2017,larceny,NJ0160200,NJ,Clifton Police Department,PASSAIC
1441,113,29,2017,larceny,NJ0160300,NJ,Haledon Police Department,PASSAIC
1442,192,16,2017,larceny,NJ0160400,NJ,Hawthorne Police Department,PASSAIC
1443,93,28,2017,larceny,NJ0160500,NJ,Little Falls Township Police Department,PASSAIC
1444,28,7,2017,larceny,NJ0160600,NJ,North Haledon Police Department,PASSAIC
1445,842,62,2017,larceny,NJ0160700,NJ,Passaic Police Department,PASSAIC
1446,1776,122,2017,larceny,NJ0160800,NJ,Paterson Police Department,PASSAIC
1447,79,5,2017,larceny,NJ0160900,NJ,Pompton Lakes Police Department,PASSAIC
1448,72,0,2017,larceny,NJ0161000,NJ,Prospect Park Police Department,PASSAIC
1449,19,6,2017,larceny,NJ0161100,NJ,Ringwood Police Department,PASSAIC
1450,243,57,2017,larceny,NJ0161200,NJ,Totowa Police Department,PASSAIC
1451,69,5,2017,larceny,NJ0161300,NJ,Wanaque Police Department,PASSAIC
1452,851,304,2017,larceny,NJ0161400,NJ,Wayne Township Police Department,PASSAIC
1453,155,24,2017,larceny,NJ0161500,NJ,West Milford Township Police Department,PASSAIC
1454,133,18,2017,larceny,NJ0161600,NJ,Woodland Park Police Department,PASSAIC
1455,53,2,2017,larceny,NJ0161700,NJ,William Paterson University,PASSAIC
1456,6,0,2017,larceny,NJ016SP00,NJ,State Police: Passaic County,PASSAIC
1457,0,0,2017,larceny,NJ0170000,NJ,Salem County Sheriff's Office,SALEM
1458,2,0,2017,larceny,NJ0170200,NJ,Elmer Police Department,SALEM
1459,8,2,2017,larceny,NJ0170300,NJ,Elsinboro Township Police Department,SALEM
1460,1001,64,2017,larceny,NJ0121400,NJ,New Brunswick Police Department,MIDDLESEX
1461,567,140,2017,larceny,NJ0121500,NJ,North Brunswick Township Police Department,MIDDLESEX
1462,598,70,2017,larceny,NJ0121600,NJ,Perth Amboy Police Department,MIDDLESEX
1463,400,29,2017,larceny,NJ0121700,NJ,Piscataway Township Police Department,MIDDLESEX
1464,104,12,2017,larceny,NJ0121800,NJ,Plainsboro Township Police Department,MIDDLESEX
1465,311,12,2017,larceny,NJ0121900,NJ,Sayreville Police Department,MIDDLESEX
1466,54,1,2017,larceny,NJ0122000,NJ,South Amboy Police Department,MIDDLESEX
1467,311,47,2017,larceny,NJ0122100,NJ,South Brunswick Township Police Department,MIDDLESEX
1468,413,85,2017,larceny,NJ0122200,NJ,South Plainfield Police Department,MIDDLESEX
1469,93,16,2017,larceny,NJ0122300,NJ,South River Police Department,MIDDLESEX
1470,54,14,2017,larceny,NJ0122400,NJ,Spotswood Police Department,MIDDLESEX
1471,1279,292,2017,larceny,NJ0122500,NJ,Woodbridge Township Police Department,MIDDLESEX
1472,13,0,2017,larceny,NJ0122600,NJ,Middlesex County College,MIDDLESEX
1473,347,40,2017,larceny,NJ0123000,NJ,Rutgers University: New Brunswick,MIDDLESEX
1474,22,4,2017,larceny,NJ012SP00,NJ,State Police: Middlesex County,MIDDLESEX
1475,1,1,2017,larceny,NJ0130000,NJ,Monmouth County Sheriff's Office,MONMOUTH
1476,24,2,2017,larceny,NJ0130100,NJ,Allenhurst Police Department,MONMOUTH
1477,4,0,2017,larceny,NJ0130200,NJ,Allentown Police Department,MONMOUTH
1478,589,101,2017,larceny,NJ0130300,NJ,Asbury Park Police Department,MONMOUTH
1479,29,2,2017,larceny,NJ0130400,NJ,Colts Neck Township Police Department,MONMOUTH
1480,5,0,2017,larceny,NJ0051300,NJ,West Wildwood Police Department,CAPE MAY
1481,382,51,2017,larceny,NJ0051400,NJ,Wildwood Police Department,CAPE MAY
1482,66,7,2017,larceny,NJ0051500,NJ,Wildwood Crest Police Department,CAPE MAY
1483,172,71,2017,larceny,NJ005SP00,NJ,State Police: Cape May County,CAPE MAY
1484,1,1,2017,larceny,NJ0060000,NJ,Cumberland County Sheriff's Office,CUMBERLAND
1485,710,58,2017,larceny,NJ0060100,NJ,Bridgeton Police Department,CUMBERLAND
1486,1280,294,2017,larceny,NJ0061000,NJ,Millville Police Department,CUMBERLAND
1487,1883,445,2017,larceny,NJ0061400,NJ,Vineland Police Department,CUMBERLAND
1488,339,218,2017,larceny,NJ006SP00,NJ,State Police: Cumberland County,CUMBERLAND
1489,36,2,2017,larceny,NJ0070000,NJ,Essex County Sheriff's Office,ESSEX
1490,471,75,2017,larceny,NJ0070100,NJ,Belleville Police Department,ESSEX
1491,619,248,2017,larceny,NJ0070200,NJ,Bloomfield Police Department,ESSEX
1492,43,3,2017,larceny,NJ0070300,NJ,Caldwell Police Department,ESSEX
1493,155,36,2017,larceny,NJ0070400,NJ,"Fairfield Township, Essex County Police Department",ESSEX
1494,64,12,2017,larceny,NJ0070500,NJ,Cedar Grove Township Police Department,ESSEX
1495,552,114,2017,larceny,NJ0070600,NJ,East Orange Police Department,ESSEX
1496,7,0,2017,larceny,NJ0070700,NJ,Essex Fells Police Department,ESSEX
1497,114,15,2017,larceny,NJ0070800,NJ,Glen Ridge Police Department,ESSEX
1498,710,92,2017,larceny,NJ0070900,NJ,Irvington Police Department,ESSEX
1499,299,132,2017,larceny,NJ0071000,NJ,Livingston Township Police Department,ESSEX
1500,12,3,2017,larceny,NJ0025300,NJ,River Vale Township Police Department,BERGEN
1501,74,12,2017,larceny,NJ0025400,NJ,Rochelle Park Township Police Department,BERGEN
1502,0,0,2017,larceny,NJ0025500,NJ,Rockleigh Police Department,BERGEN
1503,166,21,2017,larceny,NJ0025600,NJ,Rutherford Police Department,BERGEN
1504,190,69,2017,larceny,NJ0025700,NJ,Saddle Brook Township Police Department,BERGEN
1505,13,4,2017,larceny,NJ0025800,NJ,Saddle River Police Department,BERGEN
1506,48,16,2017,larceny,NJ0025900,NJ,South Hackensack Township Police Department,BERGEN
1507,299,25,2017,larceny,NJ0026000,NJ,Teaneck Township Police Department,BERGEN
1508,48,8,2017,larceny,NJ0026100,NJ,Tenafly Police Department,BERGEN
1509,121,45,2017,larceny,NJ0026200,NJ,Teterboro Police Department,BERGEN
1510,14,3,2017,larceny,NJ0026300,NJ,Upper Saddle River Police Department,BERGEN
1511,50,6,2017,larceny,NJ0026400,NJ,Waldwick Police Department,BERGEN
1512,120,28,2017,larceny,NJ0026500,NJ,Wallington Police Department,BERGEN
1513,8,1,2017,larceny,NJ0026600,NJ,"Washington Township, Bergen County Police Department",BERGEN
1514,35,7,2017,larceny,NJ0026700,NJ,Westwood Police Department,BERGEN
1515,18,4,2017,larceny,NJ0026800,NJ,Woodcliff Lake Police Department,BERGEN
1516,60,1,2017,larceny,NJ0026900,NJ,Wood-Ridge Police Department,BERGEN
1517,76,19,2017,larceny,NJ0027000,NJ,Wyckoff Township Police Department,BERGEN
1518,38,12,2017,larceny,NJ002SP00,NJ,State Police: Bergen County,BERGEN
1519,26,8,2017,larceny,NJ0030200,NJ,Beverly Police Department,BURLINGTON
1520,97,44,2017,larceny,NJ0211600,NJ,"Mansfield Township, Warren County Police Department",WARREN
1521,10,0,2017,larceny,NJ0211700,NJ,Oxford Township Police Department,WARREN
1522,282,32,2017,larceny,NJ0211900,NJ,Phillipsburg Police Department,WARREN
1523,140,57,2017,larceny,NJ0212000,NJ,Pohatcong Township Police Department,WARREN
1524,63,7,2017,larceny,NJ0212100,NJ,Washington Police Department,WARREN
1525,46,7,2017,larceny,NJ0212200,NJ,"Washington Township, Warren County Police Department",WARREN
1526,89,9,2017,larceny,NJ021SP00,NJ,State Police: Warren County,WARREN
1527,3200,170,2017,larceny,NJNPD0000,NJ,Newark Police Department,ESSEX
1528,3,0,2017,larceny,NJNPIPP00,NJ,Palisades Interstate Parkway,BERGEN
1529,463,74,2017,larceny,NJNYPOA00,NJ,Port Authority of New York and New Jersey,N/A
1530,0,0,2017,larceny,NJ0010000,NJ,Atlantic County Sheriff's Office,ATLANTIC
1531,194,53,2017,larceny,NJ0010100,NJ,Absecon Police Department,ATLANTIC
1532,1298,274,2017,larceny,NJ0010200,NJ,Atlantic City Police Department,ATLANTIC
1533,84,5,2017,larceny,NJ0010300,NJ,Brigantine Police Department,ATLANTIC
1534,90,6,2017,larceny,NJ0010400,NJ,Buena Police Department,ATLANTIC
1535,107,36,2017,larceny,NJ0010700,NJ,Egg Harbor City Police Department,ATLANTIC
1536,681,320,2017,larceny,NJ0010800,NJ,Egg Harbor Township Police Department,ATLANTIC
1537,497,39,2017,larceny,NJ0011100,NJ,Galloway Township Police Department,ATLANTIC
1538,690,229,2017,larceny,NJ0011200,NJ,"Hamilton Township, Atlantic County Police Department",ATLANTIC
1539,134,37,2017,larceny,NJ0011300,NJ,Hammonton Police Department,ATLANTIC
1540,21,1,2017,larceny,NJ0180100,NJ,Bedminster Township Police Department,SOMERSET
1541,88,4,2017,larceny,NJ0180200,NJ,Bernards Township Police Department,SOMERSET
1542,36,2,2017,larceny,NJ0180300,NJ,Bernardsville Police Department,SOMERSET
1543,133,16,2017,larceny,NJ0180400,NJ,Bound Brook Police Department,SOMERSET
1544,46,8,2017,larceny,NJ0180500,NJ,Branchburg Township Police Department,SOMERSET
1545,313,105,2017,larceny,NJ0180600,NJ,Bridgewater Township Police Department,SOMERSET
1546,4,1,2017,larceny,NJ0180700,NJ,Far Hills Police Department,SOMERSET
1547,578,29,2017,larceny,NJ0180800,NJ,"Franklin Township, Somerset County Police Department",SOMERSET
1548,53,10,2017,larceny,NJ0180900,NJ,Green Brook Township Police Department,SOMERSET
1549,205,7,2017,larceny,NJ0181000,NJ,Hillsborough Township Police Department,SOMERSET
1550,138,60,2017,larceny,NJ0181100,NJ,Manville Police Department,SOMERSET
1551,81,3,2017,larceny,NJ0181300,NJ,Montgomery Township Police Department,SOMERSET
1552,404,44,2017,larceny,NJ0181400,NJ,North Plainfield Police Department,SOMERSET
1553,10,4,2017,larceny,NJ0181500,NJ,Peapack and Gladstone Police Department,SOMERSET
1554,76,14,2017,larceny,NJ0181600,NJ,Raritan Police Department,SOMERSET
1555,99,5,2017,larceny,NJ0181800,NJ,Somerville Police Department,SOMERSET
1556,23,5,2017,larceny,NJ0181900,NJ,South Bound Brook Police Department,SOMERSET
1557,31,2,2017,larceny,NJ0182000,NJ,Warren Township Police Department,SOMERSET
1558,334,102,2017,larceny,NJ0182100,NJ,Watchung Police Department,SOMERSET
1559,8,0,2017,larceny,NJ018SP00,NJ,State Police: Somerset County,SOMERSET
1560,10,2,2017,larceny,NJ0152300,NJ,Plumsted Township Police Department,OCEAN
1561,106,14,2017,larceny,NJ0152400,NJ,Point Pleasant Police Department,OCEAN
1562,73,16,2017,larceny,NJ0152500,NJ,Point Pleasant Beach Police Department,OCEAN
1563,101,25,2017,larceny,NJ0152600,NJ,Seaside Heights Police Department,OCEAN
1564,17,0,2017,larceny,NJ0152700,NJ,Seaside Park Police Department,OCEAN
1565,15,0,2017,larceny,NJ0152800,NJ,Ship Bottom Police Department,OCEAN
1566,46,2,2017,larceny,NJ0152900,NJ,South Toms River Police Department,OCEAN
1567,179,82,2017,larceny,NJ0153000,NJ,Stafford Township Police Department,OCEAN
1568,23,7,2017,larceny,NJ0153100,NJ,Surf City Police Department,OCEAN
1569,41,4,2017,larceny,NJ0153200,NJ,Tuckerton Police Department,OCEAN
1570,102,38,2017,larceny,NJ0153300,NJ,Barnegat Township Police Department,OCEAN
1571,18,3,2017,larceny,NJ015SP00,NJ,State Police: Ocean County,OCEAN
1572,35,5,2017,larceny,NJ0160100,NJ,Bloomingdale Police Department,PASSAIC
1573,1086,198,2017,larceny,NJ0160200,NJ,Clifton Police Department,PASSAIC
1574,113,29,2017,larceny,NJ0160300,NJ,Haledon Police Department,PASSAIC
1575,192,16,2017,larceny,NJ0160400,NJ,Hawthorne Police Department,PASSAIC
1576,93,28,2017,larceny,NJ0160500,NJ,Little Falls Township Police Department,PASSAIC
1577,28,7,2017,larceny,NJ0160600,NJ,North Haledon Police Department,PASSAIC
1578,842,62,2017,larceny,NJ0160700,NJ,Passaic Police Department,PASSAIC
1579,1776,122,2017,larceny,NJ0160800,NJ,Paterson Police Department,PASSAIC
1580,4,3,2017,larceny,NJ0150000,NJ,Ocean County Sheriff's Office,OCEAN
1581,0,0,2017,larceny,NJ0150100,NJ,Barnegat Light Police Department,OCEAN
1582,16,2,2017,larceny,NJ0150200,NJ,Bay Head Police Department,OCEAN
1583,104,12,2017,larceny,NJ0150300,NJ,Beach Haven Police Department,OCEAN
1584,114,7,2017,larceny,NJ0150400,NJ,Beachwood Police Department,OCEAN
1585,362,25,2017,larceny,NJ0150500,NJ,Berkeley Township Police Department,OCEAN
1586,898,136,2017,larceny,NJ0150600,NJ,Brick Township Police Department,OCEAN
1587,1331,189,2017,larceny,NJ0150700,NJ,Toms River Township Police Department,OCEAN
1588,15,7,2017,larceny,NJ0150900,NJ,Harvey Cedars Police Department,OCEAN
1589,8,0,2017,larceny,NJ0151000,NJ,Island Heights Police Department,OCEAN
1590,355,47,2017,larceny,NJ0151100,NJ,Jackson Township Police Department,OCEAN
1591,279,69,2017,larceny,NJ0151200,NJ,Lacey Township Police Department,OCEAN
1592,31,15,2017,larceny,NJ0151300,NJ,Lakehurst Police Department,OCEAN
1593,689,104,2017,larceny,NJ0151400,NJ,Lakewood Township Police Department,OCEAN
1594,17,0,2017,larceny,NJ0151500,NJ,Lavallette Police Department,OCEAN
1595,213,34,2017,larceny,NJ0151600,NJ,Little Egg Harbor Township Police Department,OCEAN
1596,87,0,2017,larceny,NJ0151700,NJ,Long Beach Township Police Department,OCEAN
1597,186,23,2017,larceny,NJ0151800,NJ,Manchester Township Police Department,OCEAN
1598,8,1,2017,larceny,NJ0151900,NJ,Mantoloking Police Department,OCEAN
1599,54,0,2017,larceny,NJ0152000,NJ,"Ocean Township, Ocean County Police Department",OCEAN
1600,11,1,2017,larceny,NJ014SP00,NJ,State Police: Morris County,MORRIS
1601,4,3,2017,larceny,NJ0150000,NJ,Ocean County Sheriff's Office,OCEAN
1602,0,0,2017,larceny,NJ0150100,NJ,Barnegat Light Police Department,OCEAN
1603,16,2,2017,larceny,NJ0150200,NJ,Bay Head Police Department,OCEAN
1604,104,12,2017,larceny,NJ0150300,NJ,Beach Haven Police Department,OCEAN
1605,114,7,2017,larceny,NJ0150400,NJ,Beachwood Police Department,OCEAN
1606,362,25,2017,larceny,NJ0150500,NJ,Berkeley Township Police Department,OCEAN
1607,898,136,2017,larceny,NJ0150600,NJ,Brick Township Police Department,OCEAN
1608,1331,189,2017,larceny,NJ0150700,NJ,Toms River Township Police Department,OCEAN
1609,15,7,2017,larceny,NJ0150900,NJ,Harvey Cedars Police Department,OCEAN
1610,8,0,2017,larceny,NJ0151000,NJ,Island Heights Police Department,OCEAN
1611,355,47,2017,larceny,NJ0151100,NJ,Jackson Township Police Department,OCEAN
1612,279,69,2017,larceny,NJ0151200,NJ,Lacey Township Police Department,OCEAN
1613,31,15,2017,larceny,NJ0151300,NJ,Lakehurst Police Department,OCEAN
1614,689,104,2017,larceny,NJ0151400,NJ,Lakewood Township Police Department,OCEAN
1615,17,0,2017,larceny,NJ0151500,NJ,Lavallette Police Department,OCEAN
1616,213,34,2017,larceny,NJ0151600,NJ,Little Egg Harbor Township Police Department,OCEAN
1617,87,0,2017,larceny,NJ0151700,NJ,Long Beach Township Police Department,OCEAN
1618,186,23,2017,larceny,NJ0151800,NJ,Manchester Township Police Department,OCEAN
1619,8,1,2017,larceny,NJ0151900,NJ,Mantoloking Police Department,OCEAN
1620,2,1,2017,motor-vehicle-theft,NJ0160100,NJ,Bloomingdale Police Department,PASSAIC
1621,109,1,2017,motor-vehicle-theft,NJ0160200,NJ,Clifton Police Department,PASSAIC
1622,13,3,2017,motor-vehicle-theft,NJ0160300,NJ,Haledon Police Department,PASSAIC
1623,8,0,2017,motor-vehicle-theft,NJ0160400,NJ,Hawthorne Police Department,PASSAIC
1624,10,0,2017,motor-vehicle-theft,NJ0160500,NJ,Little Falls Township Police Department,PASSAIC
1625,0,0,2017,motor-vehicle-theft,NJ0160600,NJ,North Haledon Police Department,PASSAIC
